{
  "schema_version": "anchor.gemma3-chat-final-producer-git-overlay-config.v1",
  "claim_scope": "additive_posthoc_git_provenance_non_authorizing",
  "paths": {
    "producer_repo_hint": "anchor-moe-lora-gemma3-chat-v1",
    "default_output_dir": "artifacts/diagnostics/gemma3_chat_final_producer_git_overlay_v1/producer-final-5a8343b"
  },
  "producer_git": {
    "repository_id": "anchor-moe-lora-gemma3-chat-v1",
    "branch_ref": "refs/heads/research/gemma3-chat-five-expert-qonly-v1",
    "local_tracking_ref": "refs/remotes/origin/research/gemma3-chat-five-expert-qonly-v1",
    "commit_sha1": "5a8343baa117f8ec2340debaa3fbc727ee993da2",
    "tree_sha1": "a9b87ad36773c31506118c13250af0a83fd5752d",
    "parent_commit_sha1": "8ecef30d29d4c4a2e990ebc543dab21a6e3c33b1",
    "parent_tree_sha1": "c19e2b485c6d7b062ca4fa00f3eaaa3bb8d146f2",
    "changed_file_count": 24,
    "added_file_count": 23,
    "modified_file_count": 1,
    "artifacts": [
      {
        "path": ".gitattributes",
        "status": "M",
        "blob_sha1": "122d0aebb9390b366910fc8acc47b98a1cd9d863",
        "bytes": 10070,
        "sha256": "4c9f919686fdfb5b6c5c38cf50b24ea218d1ce89494d8f092801901c5e8a4d9f",
        "parent_blob_sha1": "dd08627f0ab4e02fd47a26772621bcb2d43bb538"
      },
      {
        "path": "configs/research/gemma3_chat_five_expert_qonly_v1.yaml",
        "status": "A",
        "blob_sha1": "bc5c49226aa9e56d8ed0835f7a72aad8600ca2b9",
        "bytes": 5214,
        "sha256": "2e93ab6b53f68814a4ae017643ddc4c7113716e871b2fa4ef4346358d2269cee",
        "parent_blob_sha1": null
      },
      {
        "path": "configs/research/gemma3_chat_five_expert_qonly_v1_build_receipt.schema.json",
        "status": "A",
        "blob_sha1": "3e2d6cf21778cb33efea51ef7bb5d0c325e8fdf9",
        "bytes": 14905,
        "sha256": "05fa564438257f46593b6bf53e218b4866cc2f663a5100fdf1ea7a8c8a4da2b9",
        "parent_blob_sha1": null
      },
      {
        "path": "configs/research/gemma3_chat_five_expert_qonly_v1_closed_grammar.json",
        "status": "A",
        "blob_sha1": "6e1eb7b974929ee22ec11bf0cec411a5249e009d",
        "bytes": 253596,
        "sha256": "3a76e9cb7eb0e451a435e5d6ef4dd8db3624b5674a7a546f3b709e33339a7d92",
        "parent_blob_sha1": null
      },
      {
        "path": "configs/research/gemma3_chat_five_expert_qonly_v1_closed_grammar.schema.json",
        "status": "A",
        "blob_sha1": "1052922e161667892ca91bd530251e3415e2ce51",
        "bytes": 4946,
        "sha256": "b5b5661e76d20dc23d644ca9766e3da6af45217c3f448d3cae7799075f98416b",
        "parent_blob_sha1": null
      },
      {
        "path": "configs/research/gemma3_chat_five_expert_qonly_v1_config.schema.json",
        "status": "A",
        "blob_sha1": "efe73dc3d29a6f8bea2a2c9a541089556a76009b",
        "bytes": 12375,
        "sha256": "3ea446fcebeb8e254d7550caffc787e0ae1c2da24c604398a0566a61ed105d9f",
        "parent_blob_sha1": null
      },
      {
        "path": "configs/research/gemma3_chat_five_expert_qonly_v1_manifest.schema.json",
        "status": "A",
        "blob_sha1": "abe63bd3d13ed3b757ed9a5267fd06f280870550",
        "bytes": 11732,
        "sha256": "fda04d77c494cd5d87ea19aade7db24717c6dffad6880078df19787d519f0b8b",
        "parent_blob_sha1": null
      },
      {
        "path": "configs/research/gemma3_chat_five_expert_qonly_v1_record.schema.json",
        "status": "A",
        "blob_sha1": "f86e940bdbbaf6cf2c774a8ed8a2a2310352b2c6",
        "bytes": 12829,
        "sha256": "ba1606f07d250eec7f01bffceaa507edd4f596f83018806df9130d32ecf39d9b",
        "parent_blob_sha1": null
      },
      {
        "path": "configs/research/gemma3_chat_five_expert_qonly_v1_token_inventory.schema.json",
        "status": "A",
        "blob_sha1": "8ecb9a96819a917dfabf72dcf19061cc91629eb0",
        "bytes": 2684,
        "sha256": "3b996a83d19a41b10da679a88d29db4994996562cc6dfe6220af619f35935ce7",
        "parent_blob_sha1": null
      },
      {
        "path": "docs/research/gemma3_chat_five_expert_qonly_v1.md",
        "status": "A",
        "blob_sha1": "d24305afa6ab4f1b95fed380ecd08792b81143b6",
        "bytes": 13734,
        "sha256": "f6811c5535a06d12dc395bfdf1a5f05a40aa50cbd920331a30a6a04cebacf321",
        "parent_blob_sha1": null
      },
      {
        "path": "docs/research/gemma3_chat_five_expert_qonly_v1.zh-CN.md",
        "status": "A",
        "blob_sha1": "7cb82e673ce2627b97f60abaaebfef3d61150ccd",
        "bytes": 12794,
        "sha256": "f29997ca95ecb5c845beba42f122c2283709e90b7e77a17d630193a35178f1a2",
        "parent_blob_sha1": null
      },
      {
        "path": "fixtures/research/gemma3_chat_five_expert_distilled_v1/build_receipt.json",
        "status": "A",
        "blob_sha1": "e5f126a736c5c29d5297bab96ebf6377146d77e4",
        "bytes": 8858,
        "sha256": "013d55017c82d3d407477eca673f8990da02e2bbb037109ea3b3feb7f98dfc82",
        "parent_blob_sha1": null
      },
      {
        "path": "fixtures/research/gemma3_chat_five_expert_distilled_v1/build_receipt.json.sha256",
        "status": "A",
        "blob_sha1": "0ffab4f5991dcb37f0e7212685ac53d2cc4ef70c",
        "bytes": 85,
        "sha256": "d50bb43836f02af6034d9d636669796024570a97a1e2fac59085676d05c38fce",
        "parent_blob_sha1": null
      },
      {
        "path": "fixtures/research/gemma3_chat_five_expert_distilled_v1/eval_proxy/chat.jsonl",
        "status": "A",
        "blob_sha1": "348d2990796215c2c9690074e8b84b1bef3f0d7a",
        "bytes": 856113,
        "sha256": "2e1434229482b21ee908cfee8f389523c6730691ade177f47948ad8350821a86",
        "parent_blob_sha1": null
      },
      {
        "path": "fixtures/research/gemma3_chat_five_expert_distilled_v1/manifest.json",
        "status": "A",
        "blob_sha1": "3463435c69de439a8a183bf519d44941c75631fa",
        "bytes": 3651,
        "sha256": "e71fb5f239d7d1abb94ff50d5db2d57cfd101ccfad3c2c4e34cc128a7e91317b",
        "parent_blob_sha1": null
      },
      {
        "path": "fixtures/research/gemma3_chat_five_expert_distilled_v1/manifest.json.sha256",
        "status": "A",
        "blob_sha1": "33235ec0d733d34e79b05e858e2ce10af7ab1b27",
        "bytes": 80,
        "sha256": "f3359d0bac4699f74bdd75834d4f9bf09196caef0e9e14fb63375e64cc9a88c1",
        "parent_blob_sha1": null
      },
      {
        "path": "fixtures/research/gemma3_chat_five_expert_distilled_v1/token_inventory.jsonl",
        "status": "A",
        "blob_sha1": "d985ff37e29f3a1d236e10f7bab4187a22f5e6cd",
        "bytes": 1082847,
        "sha256": "d5c149264e7bb2e4c2256bda72422bd1fdf41822b012c29d006035edabd8f2f6",
        "parent_blob_sha1": null
      },
      {
        "path": "fixtures/research/gemma3_chat_five_expert_distilled_v1/train/chat.jsonl",
        "status": "A",
        "blob_sha1": "2f9328c88a9670122abb69954bbb39ad0e4dc173",
        "bytes": 3415161,
        "sha256": "26fd3f5c30d402ab684d67977b8e790470c85f2c33436047d1cdb237c00379dc",
        "parent_blob_sha1": null
      },
      {
        "path": "scripts/research/audit_gemma3_chat_five_expert_qonly_v1.py",
        "status": "A",
        "blob_sha1": "9210d2b511cfd6815b586c28f24c388eda832612",
        "bytes": 466,
        "sha256": "f8382298387b2930ba173fc5bbd8f52858f2622c9e356e7f23cb3c02efdd801c",
        "parent_blob_sha1": null
      },
      {
        "path": "scripts/research/build_gemma3_chat_five_expert_qonly_v1.py",
        "status": "A",
        "blob_sha1": "6313094082a7c7818734db3ce80ee9281fd62ce1",
        "bytes": 466,
        "sha256": "90a82d5ad71ae6d6c1de9e9bd0636f2258151f17c3dff2b5ec0646181daf2d89",
        "parent_blob_sha1": null
      },
      {
        "path": "src/anchor_mvp/research/gemma3_chat_five_expert_qonly_v1.py",
        "status": "A",
        "blob_sha1": "abf2e253b9335bf461be884c97640088d8741cb1",
        "bytes": 175336,
        "sha256": "98eeac4150a5c51dd422bfe6163e34ce26d691038b497343c20af0a19552fb6f",
        "parent_blob_sha1": null
      },
      {
        "path": "tests/test_gemma3_chat_five_expert_qonly_v1.py",
        "status": "A",
        "blob_sha1": "e34fd70ca781650fc2956506e42b6e0cd471d91b",
        "bytes": 53424,
        "sha256": "762216a278192294b6911aa661c0605407ce677d70b449040b5030f469229675",
        "parent_blob_sha1": null
      },
      {
        "path": "tests/test_gemma3_chat_natural_task_semantics.py",
        "status": "A",
        "blob_sha1": "f2b1fce011345993e7459fa87cea2731d632618c",
        "bytes": 4685,
        "sha256": "2bfb60e3b91fda7a820a01f5fd6d789a851e66227520f7e0f74d237254b8c3e7",
        "parent_blob_sha1": null
      },
      {
        "path": "tests/test_gemma3_chat_persona_semantics.py",
        "status": "A",
        "blob_sha1": "22d3cbfd8ea45a35be81527c3464b4407c79e2d5",
        "bytes": 16761,
        "sha256": "015cfe8e638b2cb5eb43e781ed07d934687e40e1eeb26dfdadf9d90d1072783e",
        "parent_blob_sha1": null
      }
    ]
  },
  "runtime_copies": [
    {
      "producer_path": "configs/research/gemma3_chat_five_expert_qonly_v1.yaml",
      "consumer_path": "configs/research/gemma3_chat_five_expert_qonly_v1.yaml",
      "blob_sha1": "bc5c49226aa9e56d8ed0835f7a72aad8600ca2b9",
      "bytes": 5214,
      "sha256": "2e93ab6b53f68814a4ae017643ddc4c7113716e871b2fa4ef4346358d2269cee"
    },
    {
      "producer_path": "configs/research/gemma3_chat_five_expert_qonly_v1_config.schema.json",
      "consumer_path": "configs/research/gemma3_chat_five_expert_qonly_v1_config.schema.json",
      "blob_sha1": "efe73dc3d29a6f8bea2a2c9a541089556a76009b",
      "bytes": 12375,
      "sha256": "3ea446fcebeb8e254d7550caffc787e0ae1c2da24c604398a0566a61ed105d9f"
    },
    {
      "producer_path": "configs/research/gemma3_chat_five_expert_qonly_v1_closed_grammar.json",
      "consumer_path": "configs/research/gemma3_chat_five_expert_qonly_v1_closed_grammar.json",
      "blob_sha1": "6e1eb7b974929ee22ec11bf0cec411a5249e009d",
      "bytes": 253596,